{"actors":[{"assetId":"CHR_MINH_KIEM_WALK","engineImport":"UNVERIFIED","frames":[{"column":0,"direction":"N","pixelRectTopLeft":{"height":64,"width":48,"x":0,"y":0},"pixelRectUnity":{"height":64,"width":48,"x":0,"y":448}},{"column":1,"direction":"N","pixelRectTopLeft":{"height":64,"width":48,"x":48,"y":0},"pixelRectUnity":{"height":64,"width":48,"x":48,"y":448}},{"column":2,"direction":"N","pixelRectTopLeft":{"height":64,"width":48,"x":96,"y":0},"pixelRectUnity":{"height":64,"width":48,"x":96,"y":448}},{"column":3,"direction":"N","pixelRectTopLeft":{"height":64,"width":48,"x":144,"y":0},"pixelRectUnity":{"height":64,"width":48,"x":144,"y":448}},{"column":4,"direction":"N","pixelRectTopLeft":{"height":64,"width":48,"x":192,"y":0},"pixelRectUnity":{"height":64,"width":48,"x":192,"y":448}},{"column":5,"direction":"N","pixelRectTopLeft":{"height":64,"width":48,"x":240,"y":0},"pixelRectUnity":{"height":64,"width":48,"x":240,"y":448}},{"column":0,"direction":"NE","pixelRectTopLeft":{"height":64,"width":48,"x":0,"y":64},"pixelRectUnity":{"height":64,"width":48,"x":0,"y":384}},{"column":1,"direction":"NE","pixelRectTopLeft":{"height":64,"width":48,"x":48,"y":64},"pixelRectUnity":{"height":64,"width":48,"x":48,"y":384}},{"column":2,"direction":"NE","pixelRectTopLeft":{"height":64,"width":48,"x":96,"y":64},"pixelRectUnity":{"height":64,"width":48,"x":96,"y":384}},{"column":3,"direction":"NE","pixelRectTopLeft":{"height":64,"width":48,"x":144,"y":64},"pixelRectUnity":{"height":64,"width":48,"x":144,"y":384}},{"column":4,"direction":"NE","pixelRectTopLeft":{"height":64,"width":48,"x":192,"y":64},"pixelRectUnity":{"height":64,"width":48,"x":192,"y":384}},{"column":5,"direction":"NE","pixelRectTopLeft":{"height":64,"width":48,"x":240,"y":64},"pixelRectUnity":{"height":64,"width":48,"x":240,"y":384}},{"column":0,"direction":"E","pixelRectTopLeft":{"height":64,"width":48,"x":0,"y":128},"pixelRectUnity":{"height":64,"width":48,"x":0,"y":320}},{"column":1,"direction":"E","pixelRectTopLeft":{"height":64,"width":48,"x":48,"y":128},"pixelRectUnity":{"height":64,"width":48,"x":48,"y":320}},{"column":2,"direction":"E","pixelRectTopLeft":{"height":64,"width":48,"x":96,"y":128},"pixelRectUnity":{"height":64,"width":48,"x":96,"y":320}},{"column":3,"direction":"E","pixelRectTopLeft":{"height":64,"width":48,"x":144,"y":128},"pixelRectUnity":{"height":64,"width":48,"x":144,"y":320}},{"column":4,"direction":"E","pixelRectTopLeft":{"height":64,"width":48,"x":192,"y":128},"pixelRectUnity":{"height":64,"width":48,"x":192,"y":320}},{"column":5,"direction":"E","pixelRectTopLeft":{"height":64,"width":48,"x":240,"y":128},"pixelRectUnity":{"height":64,"width":48,"x":240,"y":320}},{"column":0,"direction":"SE","pixelRectTopLeft":{"height":64,"width":48,"x":0,"y":192},"pixelRectUnity":{"height":64,"width":48,"x":0,"y":256}},{"column":1,"direction":"SE","pixelRectTopLeft":{"height":64,"width":48,"x":48,"y":192},"pixelRectUnity":{"height":64,"width":48,"x":48,"y":256}},{"column":2,"direction":"SE","pixelRectTopLeft":{"height":64,"width":48,"x":96,"y":192},"pixelRectUnity":{"height":64,"width":48,"x":96,"y":256}},{"column":3,"direction":"SE","pixelRectTopLeft":{"height":64,"width":48,"x":144,"y":192},"pixelRectUnity":{"height":64,"width":48,"x":144,"y":256}},{"column":4,"direction":"SE","pixelRectTopLeft":{"height":64,"width":48,"x":192,"y":192},"pixelRectUnity":{"height":64,"width":48,"x":192,"y":256}},{"column":5,"direction":"SE","pixelRectTopLeft":{"height":64,"width":48,"x":240,"y":192},"pixelRectUnity":{"height":64,"width":48,"x":240,"y":256}},{"column":0,"direction":"S","pixelRectTopLeft":{"height":64,"width":48,"x":0,"y":256},"pixelRectUnity":{"height":64,"width":48,"x":0,"y":192}},{"column":1,"direction":"S","pixelRectTopLeft":{"height":64,"width":48,"x":48,"y":256},"pixelRectUnity":{"height":64,"width":48,"x":48,"y":192}},{"column":2,"direction":"S","pixelRectTopLeft":{"height":64,"width":48,"x":96,"y":256},"pixelRectUnity":{"height":64,"width":48,"x":96,"y":192}},{"column":3,"direction":"S","pixelRectTopLeft":{"height":64,"width":48,"x":144,"y":256},"pixelRectUnity":{"height":64,"width":48,"x":144,"y":192}},{"column":4,"direction":"S","pixelRectTopLeft":{"height":64,"width":48,"x":192,"y":256},"pixelRectUnity":{"height":64,"width":48,"x":192,"y":192}},{"column":5,"direction":"S","pixelRectTopLeft":{"height":64,"width":48,"x":240,"y":256},"pixelRectUnity":{"height":64,"width":48,"x":240,"y":192}},{"column":0,"direction":"SW","pixelRectTopLeft":{"height":64,"width":48,"x":0,"y":320},"pixelRectUnity":{"height":64,"width":48,"x":0,"y":128}},{"column":1,"direction":"SW","pixelRectTopLeft":{"height":64,"width":48,"x":48,"y":320},"pixelRectUnity":{"height":64,"width":48,"x":48,"y":128}},{"column":2,"direction":"SW","pixelRectTopLeft":{"height":64,"width":48,"x":96,"y":320},"pixelRectUnity":{"height":64,"width":48,"x":96,"y":128}},{"column":3,"direction":"SW","pixelRectTopLeft":{"height":64,"width":48,"x":144,"y":320},"pixelRectUnity":{"height":64,"width":48,"x":144,"y":128}},{"column":4,"direction":"SW","pixelRectTopLeft":{"height":64,"width":48,"x":192,"y":320},"pixelRectUnity":{"height":64,"width":48,"x":192,"y":128}},{"column":5,"direction":"SW","pixelRectTopLeft":{"height":64,"width":48,"x":240,"y":320},"pixelRectUnity":{"height":64,"width":48,"x":240,"y":128}},{"column":0,"direction":"W","pixelRectTopLeft":{"height":64,"width":48,"x":0,"y":384},"pixelRectUnity":{"height":64,"width":48,"x":0,"y":64}},{"column":1,"direction":"W","pixelRectTopLeft":{"height":64,"width":48,"x":48,"y":384},"pixelRectUnity":{"height":64,"width":48,"x":48,"y":64}},{"column":2,"direction":"W","pixelRectTopLeft":{"height":64,"width":48,"x":96,"y":384},"pixelRectUnity":{"height":64,"width":48,"x":96,"y":64}},{"column":3,"direction":"W","pixelRectTopLeft":{"height":64,"width":48,"x":144,"y":384},"pixelRectUnity":{"height":64,"width":48,"x":144,"y":64}},{"column":4,"direction":"W","pixelRectTopLeft":{"height":64,"width":48,"x":192,"y":384},"pixelRectUnity":{"height":64,"width":48,"x":192,"y":64}},{"column":5,"direction":"W","pixelRectTopLeft":{"height":64,"width":48,"x":240,"y":384},"pixelRectUnity":{"height":64,"width":48,"x":240,"y":64}},{"column":0,"direction":"NW","pixelRectTopLeft":{"height":64,"width":48,"x":0,"y":448},"pixelRectUnity":{"height":64,"width":48,"x":0,"y":0}},{"column":1,"direction":"NW","pixelRectTopLeft":{"height":64,"width":48,"x":48,"y":448},"pixelRectUnity":{"height":64,"width":48,"x":48,"y":0}},{"column":2,"direction":"NW","pixelRectTopLeft":{"height":64,"width":48,"x":96,"y":448},"pixelRectUnity":{"height":64,"width":48,"x":96,"y":0}},{"column":3,"direction":"NW","pixelRectTopLeft":{"height":64,"width":48,"x":144,"y":448},"pixelRectUnity":{"height":64,"width":48,"x":144,"y":0}},{"column":4,"direction":"NW","pixelRectTopLeft":{"height":64,"width":48,"x":192,"y":448},"pixelRectUnity":{"height":64,"width":48,"x":192,"y":0}},{"column":5,"direction":"NW","pixelRectTopLeft":{"height":64,"width":48,"x":240,"y":448},"pixelRectUnity":{"height":64,"width":48,"x":240,"y":0}}],"geometry":{"animations":[{"columnEnd":5,"columnStart":0,"fps":8,"frames":6,"loop":true,"name":"walk"}],"assetId":"CHR_MINH_KIEM_WALK","directionRows":{"E":2,"N":0,"NE":1,"NW":7,"S":4,"SE":3,"SW":5,"W":6},"directional":true,"directions":["N","NE","E","SE","S","SW","W","NW"],"frameSize":{"height":64,"width":48},"grid":{"cols":6,"pixelHeight":512,"pixelWidth":288,"rows":8},"image":{"height":512,"width":288},"kind":"sprite_sheet","layout":"direction_rows","manifestVersion":1,"path":"Client/Assets/Art/Characters/MinhKiem/minh_kiem_walk.png","supported":true,"totalSprites":48,"unsupportedReasons":[],"warnings":["legacy v1 layout: frame width derived from pixelWidth/framesPerDirection","legacy v1 layout: frame height derived from pixelHeight/directionCount"]},"path":"Client/Assets/Art/Characters/MinhKiem/minh_kiem_walk.png","pivot":"bottom_center","sha256":"sha256:bbec07fba1e9c598fc4cfdb1bf2e225cd4dc7038f55911b5de948b30d9b0582d","status":"draft"}],"bundleDigest":"sha256:3f9179cf282d6aac55adbc16017946ec5bf3dfafc3a22c95a8235b94387da020","canonicalPlacementCount":349,"findings":[{"code":"OUTSIDE_CANDIDATE_LAYOUT","recordId":"MAN-BM-EVENT_BOSS_BM_MANG_COT"},{"code":"OUTSIDE_CANDIDATE_LAYOUT","recordId":"MAN-BM-FISHING-LINH"},{"code":"OUTSIDE_CANDIDATE_LAYOUT","recordId":"MAN-BM-NODE_BM_HERB_01"},{"code":"OUTSIDE_CANDIDATE_LAYOUT","recordId":"MAN-BM-NODE_BM_HERB_02"},{"code":"OUTSIDE_CANDIDATE_LAYOUT","recordId":"MAN-BM-NODE_BM_ORE_01"},{"code":"OUTSIDE_CANDIDATE_LAYOUT","recordId":"MAN-BM-NODE_BM_ORE_02"},{"code":"OUTSIDE_CANDIDATE_LAYOUT","recordId":"MAN-BM-NODE_BM_WOOD_01"},{"code":"OUTSIDE_CANDIDATE_LAYOUT","recordId":"MAN-BM-NPC_BM_RESCUE_01"},{"code":"OUTSIDE_CANDIDATE_LAYOUT","recordId":"MAN-BM-NPC_BM_RESCUE_02"},{"code":"OUTSIDE_CANDIDATE_LAYOUT","recordId":"MAN-BM-NPC_BOAT_KEEPER"},{"code":"OUTSIDE_CANDIDATE_LAYOUT","recordId":"MAN-BM-NPC_CLASS_TRIAL"},{"code":"OUTSIDE_CANDIDATE_LAYOUT","recordId":"MAN-BM-NPC_FISHER_01"},{"code":"OUTSIDE_CANDIDATE_LAYOUT","recordId":"MAN-BM-NPC_LYAN"},{"code":"OUTSIDE_CANDIDATE_LAYOUT","recordId":"MAN-BM-NPC_MEDIC_BEN"},{"code":"OUTSIDE_CANDIDATE_LAYOUT","recordId":"MAN-BM-NPC_TA_VAN_KHANH"},{"code":"OUTSIDE_CANDIDATE_LAYOUT","recordId":"MAN-BM-SPAWN_BM_01"},{"code":"OUTSIDE_CANDIDATE_LAYOUT","recordId":"MAN-BM-SPAWN_BM_02"},{"code":"OUTSIDE_CANDIDATE_LAYOUT","recordId":"MAN-BM-SPAWN_BM_03"},{"code":"OUTSIDE_CANDIDATE_LAYOUT","recordId":"MAN-BM-SPAWN_BM_04"},{"code":"OUTSIDE_CANDIDATE_LAYOUT","recordId":"MAN-BM-SPAWN_BM_05_QUEST"},{"code":"OUTSIDE_CANDIDATE_LAYOUT","recordId":"MAN-BM-SPAWN_BM_06"},{"code":"OUTSIDE_CANDIDATE_LAYOUT","recordId":"MAN-BM-SPAWN_BM_07"},{"code":"OUTSIDE_CANDIDATE_LAYOUT","recordId":"MAN-BM-WAVE_BM_ESCORT_A"},{"code":"OUTSIDE_CANDIDATE_LAYOUT","recordId":"MAN-BM-WAVE_BM_ESCORT_B"},{"assetId":"CHR_MINH_KIEM_WALK","code":"ART_NOT_APPROVED"}],"layers":[{"height":3,"id":"GROUND_TEST","role":"GROUND","tiles":[1,1,1,1,1,1,1,1,1,1,1,1